{
  "meta": {
    "schema_version": "transit_spec_v1",
    "engine": {
      "name": "PyJHora",
      "version": "1.0.0"
    },
    "timestamp_utc": "2025-11-20T12:00:00Z"
  },
  "person": {
    "id": "mehran",
    "label": "Mehran"
  },
  "config_echo": {
    "zodiac_type": "SIDEREAL",
    "ayanamsa_mode": "LAHIRI",
    "ayanamsa_value_deg": null,
    "house_system": "PL",
    "node_mode": "TRUE",
    "include_bodies": ["SUN", "MOON", "MARS", "MERCURY", "JUPITER", "VENUS", "SATURN", "RAHU", "KETU"]
  },
  "frames": [
    {
      "frame_id": "TRANSIT",
      "description": "Transit snapshot for the reference moment",
      "reference": {
        "datetime_utc": "2025-11-20T12:00:00Z",
        "timezone": "Asia/Tehran",
        "location": {
          "latitude": 35.6892,
          "longitude": 51.3890,
          "place_name": "Tehran, Iran"
        }
      },
      "ascendant": {
        "id": null,
        "longitude_deg": 330.52,
        "degree_in_sign": 10.52,
        "sign_index": 12,
        "sign_name": "PISCES",
        "house_index": 1,
        "nakshatra_index": 27,
        "nakshatra_name": "REVATHI",
        "nakshatra_pada": 1
      },
      "planets": [
        {
          "id": "SUN",
          "name": "Sun",
          "longitude_deg": 187.63,
          "degree_in_sign": 7.63,
          "sign_index": 7,
          "sign_name": "LIBRA",
          "house_index": 7,
          "nakshatra_index": 23,
          "nakshatra_name": "AVITTAM",
          "nakshatra_pada": 2,
          "speed_deg_per_day": 1.02,
          "retrograde": false
        }
      ]
    }
  ]
}
